data_id,iso,event_id_cnty,event_id_no_cnty,event_date,year,time_precision,event_type,sub_event_type,actor1,assoc_actor_1,inter1,actor2,assoc_actor_2,inter2,interaction,region,country,admin1,admin2,admin3,location,latitude,longitude,geo_precision,source,source_scale,notes,fatalities,timestamp,iso3
,,#event+code,,#date+occurred,#date+year,,#event+type,,#group+name+first,#group+name+first+assoc,,#group+name+second,#group+name+second+assoc,,,#region+name,#country+name,#adm1+name,#adm2+name,#adm3+name,#loc+name,#geo+lat,#geo+lon,,#meta+source,,#description,#affected+killed,,#country+code
6160653,300,GRC1040,1040,2019-10-19,2019,1,Protests,Peaceful protest,Protesters (Greece),Government of Greece (2019-),6,,,0,60,Europe,Greece,North Aegean,Samos,Samos,Samos,37.7574,26.9762,1,To Pontiki,National,"On 19 October, the mayor of East Samos and about 25 local councillors rallied at the passenger port where Frontex ships were docked and held banners reading ""Frontex do your job! Guard the European borders!"". They also protested for the transfer off Samos of the migrants and refugees living in open-air public spaces after this week's riots and fire at the reception centre that burned a large part of the camp. [size=about 25]",0,1571776728,GRC
6160654,300,GRC1041,1041,2019-10-19,2019,1,Protests,Peaceful protest,Protesters (International),Refugees/IDPs (International),6,,,0,60,Europe,Greece,North Aegean,Samos,Samos,Samos,37.7574,26.9762,1,To Pontiki,National,"On 19 October, refugees and migrants living in open-air public spaces rallied for the second time at the capital of Samos to protest after this week's riots and fire at the reception centre in Samos that burned a large part of the camp. [size=no report]",0,1571776728,GRC
6160659,300,GRC1045,1045,2019-10-19,2019,1,Protests,Peaceful protest,Protesters (Greece),POE-OTA: Panhellenic Federation of Workers of the Organisation of Local Administration Authorities; Labour Group (Greece),6,,,0,60,Europe,Greece,Attica,Athens,Central Athens,Athens-Central Athens,37.9685,23.7585,1,AMNA; To Vima,National,"On 19 October, municipal workers supported by their federation POE-OTA in their ongoing action against the proposed development bill marched in central Athens and piled up garbage outside the Ministry of Interior. [size=no report]",0,1571776728,GRC
6160660,300,GRC1046,1046,2019-10-19,2019,1,Protests,Peaceful protest,Protesters (Greece),Students (Greece); Labour Group (Greece),6,,,0,60,Europe,Greece,Central Macedonia,Thessaloniki,Thessaloniki,Thessaloniki,40.6436,22.9309,1,MAKEDONIA,Subnational,"On 19 October, the Initiative of Workers, Students and Pensioners for Urban Transport in Thessaloniki protested for better and safer public transport. [size=no report]",0,1571776728,GRC
6160661,300,GRC1047,1047,2019-10-19,2019,1,Protests,Peaceful protest,Protesters (Greece),,6,,,0,60,Europe,Greece,Central Macedonia,Thessaloniki,Thessaloniki,Thessaloniki,40.6436,22.9309,1,MAKEDONIA,Subnational,"On 19 October, members of anti-establishment groups rallied in Thessaloniki in solidarity with arrested anarchist demonstrators at the Turkish Consulate/Ataturk museum and demonstrators at the airport of Thessaloniki, who were protesting this week against Turkey's military operations in Syria. [size=no report]",0,1571776728,GRC
6160662,300,GRC1048,1048,2019-10-19,2019,1,Protests,Peaceful protest,Protesters (Greece),Students (Greece),6,,,0,60,Europe,Greece,Central Macedonia,Thessaloniki,Thessaloniki,Thessaloniki,40.6436,22.9309,1,MAKEDONIA; ThessNews,Subnational,"On 19 October, members of the Student Struggle Front and other student associations rallied in Thessaloniki in an ongoing protest against proposed education reforms. [size=no report]",0,1571776728,GRC
6160655,300,GRC1042,1042,2019-10-18,2019,1,Riots,Mob violence,Rioters (International),Refugees/IDPs (International),5,Rioters (International),Refugees/IDPs (International),5,55,Europe,Greece,Central Macedonia,Thessaloniki,Delta,Diavata,40.6885,22.8576,1,To Pontiki; ThessNews,Subnational-National,"On 18 October, there were two injuries after clashes between migrants at the Diavata camp near Thessaloniki. [size=no report]",0,1571776728,GRC
6160656,300,GRC1043,1043,2019-10-18,2019,1,Protests,Peaceful protest,Protesters (Greece),Students (Greece),6,,,0,60,Europe,Greece,Central Macedonia,Thessaloniki,Thessaloniki,Thessaloniki,40.6436,22.9309,1,MAKEDONIA,Subnational,"On 18 October, secondary school students at the Thessaloniki music school held a musical protest in central Thessaloniki for better infrastructure, more teachers and for their school to acquire certification as a music school. [size=no report]",0,1571776728,GRC
6160657,300,GRC1044,1044,2019-10-18,2019,1,Protests,Protest with intervention,Protesters (Greece),Orthodox Christian Group (Greece),6,Police Forces of Greece (2019-),Orthodox Christian Group (Turkey),1,16,Europe,Greece,Central Macedonia,Thessaloniki,Thessaloniki,Thessaloniki,40.6436,22.9309,1,MAKEDONIA,Subnational,"On 18 October, three nuns confronted the Ecumenical Patriarch of Constantinople during his visit at the Byzantine Museum of Thessaloniki and protested against the independence of the Ukrainian church from Moscow. Police officers escorted them out of the premises. [size=3]",0,1571776728,GRC
6160664,300,GRC1038,1038,2019-10-18,2019,1,Riots,Violent demonstration,Rioters (Greece),Rouvikonas,5,Civilians (Greece),Labour Group (Greece); Government of Greece (2019-),7,57,Europe,Greece,Attica,Athens,Central Athens,Athens-Central Athens,37.9685,23.7585,1,Ekathimerini,National,"On 18 October, four members of Rouvikonas splashed red paint at the entrance and caused damage in the political office of the health minister. They also scattered fliers reading 'Keep your hands off public health'. The incident took place during office hours when staff was present. There was one arrest. [size=four]",0,1571776728,GRC
6160665,300,GRC1039,1039,2019-10-18,2019,1,Protests,Peaceful protest,Protesters (International),Refugees/IDPs (International),6,,,0,60,Europe,Greece,North Aegean,Samos,Samos,Samos,37.7574,26.9762,1,To Vima,National,"On 18 October, asylum seekers at the Samos reception center protested for the second day for better living conditions and to be transferred off Samos. Employees evacuated the reception center office area as a precaution. This is part of the protests that took place after this week's riots and fire at the reception centre that burned a large part of the camp. [size=no report]",0,1571776728,GRC
6160666,300,GRC1049,1049,2019-10-18,2019,1,Protests,Peaceful protest,Protesters (Greece),Students (Greece),6,,,0,60,Europe,Greece,Thessaly,Magnesia,Volos,Volos,39.3730,22.9427,1,FoititikaNea,National,"On 18 October, students of the University of Thessaly occupied school buildings for the day and marched in Volos in an ongoing protest against education reforms. [size=no report]",0,1571776728,GRC
6160639,300,GRC1024,1024,2019-10-17,2019,1,Protests,Peaceful protest,Protesters (Greece),Students (Greece),6,,,0,60,Europe,Greece,Attica,Athens,Central Athens,Athens-Central Athens,37.9685,23.7585,1,AMNA; Ekathimerini,National,"On 17 October, students marched in central Athens in an ongoing protest against proposed education reforms and the abolition of the university asylum law. [size=no report]",0,1571776728,GRC
6160640,300,GRC1029,1029,2019-10-17,2019,1,Protests,Peaceful protest,Protesters (International),Refugees/IDPs (International),6,,,0,60,Europe,Greece,North Aegean,Samos,Samos,Samos,37.7574,26.9762,1,AMNA; To Pontiki,National,"On 17 October, refugees and migrants at the reception centre in Samos rallied and marched briefly outside the camp shouting ""Freedom!"". They protested for being transferred off Samos. This is a continuation of the previous day's sitting protest in the island's capital after this week's riots and fire at the reception centre that burned a large part of the camp. [size=no report]",0,1571776728,GRC
6160643,300,GRC1032,1032,2019-10-17,2019,1,Riots,Violent demonstration,Rioters (Greece),Students (Greece); Far Left Group (Greece),5,,,0,50,Europe,Greece,Central Macedonia,Thessaloniki,Thessaloniki,Thessaloniki,40.6436,22.9309,1,ThessNews; MAKEDONIA,Subnational,"On 17 October, members of student associations aligned with the non-parliament left rallied in Thessaloniki in ongoing demonstrations against proposed education reforms. They marched to the Ministry of Macedonia and Thrace, where they spray painted slogans and attempted to break the iron door with wooden sticks. [size=no report]",0,1571776728,GRC
6160644,300,GRC1033,1033,2019-10-17,2019,1,Protests,Peaceful protest,Protesters (Greece),POE-OTA: Panhellenic Federation of Workers of the Organisation of Local Administration Authorities; Labour Group (Greece),6,,,0,60,Europe,Greece,Central Macedonia,Thessaloniki,Thessaloniki,Thessaloniki,40.6436,22.9309,1,MAKEDONIA,Subnational,"On 17 October, members of the municipal workers' union of Thessaloniki rallied at the Ministry of Macedonia and Thrace to protest against the proposed development bill. [size=no report]",0,1571776728,GRC
6160646,300,GRC1031,1031,2019-10-17,2019,1,Protests,Protest with intervention,Protesters (Greece),Libertarian Initiative; Rouvikonas,6,Police Forces of Greece (2019-),,1,16,Europe,Greece,Central Macedonia,Thessaloniki,Thessaloniki,Thessaloniki,40.6436,22.9309,1,AMNA; Ekathimerini; MAKEDONIA,Subnational-National,"On 17 October, twelve anarchists were arrested and charged for ""exposure to the threat of retaliation"" after illegally entering the Ataturk Museum to protest against Turkey's military operations in Syria and express solidarity to Rojava. The ""Anarchist Federation"" consisting of members of Rouvikonas and the Libertarian Initiative of Thessaloniki claimed responsibility. The museum is the birthplace of the founder of modern Turkey and also houses the Turkish consulate of Thessaloniki. This is the second week of similar protests in Greece. [size=12]",0,1571776728,GRC
6160647,300,GRC1036,1036,2019-10-17,2019,1,Protests,Peaceful protest,Protesters (Greece),PAME: All-Workers Militant Front; Labour Group (Greece),6,,,0,60,Europe,Greece,Central Macedonia,Thessaloniki,Thessaloniki,Thessaloniki,40.6436,22.9309,1,To Vima,National,"On 17 October, members of PAME marched in Thessaloniki to protest against the proposed development bill. [size=no report]",0,1571776728,GRC
6160648,300,GRC1037,1037,2019-10-17,2019,1,Protests,Peaceful protest,Protesters (Greece),Rouvikonas; Libertarian Initiative; Pueblo,6,,,0,60,Europe,Greece,Central Macedonia,Thessaloniki,Thessaloniki,Thessaloniki,40.6436,22.9309,1,AMNA; Ekathimerini; To Vima,National,"On 17 October, about 10 members of the anarchist collectives Pueblo, Libertarian Initiative and Rouvikonas rallied at the departures area of Thessaloniki's airport and protested in front of the check-in counter of Turkish Airlines against Turkey's military operations in Syria. A similar protest took place on the same day at the Turkish consulate. This is the second week of protests over this issue in Greece. [size=about 10]",0,1571776728,GRC
6160649,300,GRC1025,1025,2019-10-17,2019,1,Protests,Peaceful protest,Protesters (Greece),POE-OTA: Panhellenic Federation of Workers of the Organisation of Local Administration Authorities; Labour Group (Greece),6,,,0,60,Europe,Greece,Attica,Athens,Central Athens,Athens-Central Athens,37.9685,23.7585,1,AMNA; Ekathimerini,National,"On 17 October, municipal workers on a strike action supported by their federation union POE-OTA marched in central Athens to protest against the proposed development bill. [size=no report]",0,1571776728,GRC
6160650,300,GRC1035,1035,2019-10-17,2019,1,Protests,Peaceful protest,Protesters (Greece),PAME: All-Workers Militant Front; Labour Group (Greece),6,,,0,60,Europe,Greece,Attica,Athens,Central Athens,Athens-Central Athens,37.9685,23.7585,1,To Vima,National,"On 17 October, members of PAME marched in central Athens to protest against the proposed development bill. [size=no report]",0,1571776728,GRC
6160651,300,GRC1027,1027,2019-10-17,2019,1,Protests,Peaceful protest,Protesters (Greece),Students (Greece); ANTARSYA: Front of the Greek Anticapitalist Left; KKE: Communist Party of Greece,6,,,0,60,Europe,Greece,Attica,Athens,Central Athens,Athens-Central Athens,37.9685,23.7585,1,To Vima,National,"On 17 October, students that are members of ANTARSYA and KKE rallied at the Athens University of Economics and Business and occupied the school to protest against the abolition of the university asylum law. The Rector's office announced that the protesters are not members of the official students' union. [size=no report]",0,1571776728,GRC
6160658,300,GRC1034,1034,2019-10-17,2019,1,Protests,Peaceful protest,Protesters (Greece),Kurdish Ethnic Group (Greece); ANTARSYA: Front of the Greek Anticapitalist Left,6,,,0,60,Europe,Greece,Central Macedonia,Thessaloniki,Thessaloniki,Thessaloniki,40.6436,22.9309,1,ThessNews; MAKEDONIA,Subnational,"On 17 October, members of ANTARSYA joined Kurdish protesters in a march in central Thessaloniki. They protested against Turkey's military operations in Syria. This is the second week of similar protests in Greece. [size=no report]",0,1571776728,GRC
6160663,300,GRC1026,1026,2019-10-17,2019,1,Protests,Protest with intervention,Protesters (Greece),Kurdish Ethnic Group (Greece),6,Police Forces of Greece (2019-) Units for the Reinstatement of Order,,1,16,Europe,Greece,Attica,Athens,Central Athens,Athens-Central Athens,37.9685,23.7585,1,AMNA; Ekathimerini,National,"On 17 October, Kurdish demonstrators marched in central Athens to protest against Turkey's military operations in Syria. Police prevented them from reaching the Turkish embassy. This is the second week of similar protests in Greece. [size=no report]",0,1571776728,GRC
6160641,300,GRC1030,1030,2019-10-16,2019,1,Protests,Peaceful protest,Protesters (Greece),Students (Greece),6,,,0,60,Europe,Greece,Central Macedonia,Thessaloniki,Thessaloniki,Thessaloniki,40.6436,22.9309,1,MAKEDONIA,Subnational,"On 16 October, members of the Student Struggle Front rallied outside the offices of the public bus company to protest for better services and for students to ride for free. [size=no report]",0,1571776728,GRC
6160642,300,GRC1023,1023,2019-10-16,2019,1,Protests,Peaceful protest,Protesters (Greece),,6,,,0,60,Europe,Greece,Central Macedonia,Thessaloniki,Thessaloniki,Thessaloniki,40.6436,22.9309,1,ThessNews; MAKEDONIA,Subnational,"On 16 October, members of the local party ""Menoume Thessaloniki"" rallied near the Turkish Consulate to protest against Turkey's military operations in Syria. They were holding banners against ""Turkish expansionism"" and shouting slogans connecting recent events to the massacres of Pontic and Armenian populations, as well as in Minor Asia and Cyprus. This is the second week of similar protests in Greece. [size=no report]",0,1571776728,GRC
6160652,300,GRC1028,1028,2019-10-16,2019,1,Protests,Peaceful protest,Protesters (International),Refugees/IDPs (International),6,,,0,60,Europe,Greece,North Aegean,Samos,Samos,Samos,37.7574,26.9762,1,AMNA; To Pontiki,National,"On 16 October, refugees and migrants living in open-air public spaces at the capital of Samos staged a sitting protest after this week's riots and fire at the reception centre in Samos that burned a large part of the camp. [size=no report]",0,1571776728,GRC
6160645,300,GRC1022,1022,2019-10-15,2019,1,Protests,Peaceful protest,Protesters (Greece),SYRIZA: Coalition of the Radical Left,6,,,0,60,Europe,Greece,Central Macedonia,Thessaloniki,Thessaloniki,Thessaloniki,40.6436,22.9309,1,ThessNews,Subnational,"On 15 October, members of SYRIZA rallied in front of the White Tower police station in Thessaloniki distributing fliers to protest over the way the government is handling the refugee and migration issue. [size=no report]",0,1571776728,GRC
6160635,300,GRC1018,1018,2019-10-14,2019,1,Riots,Mob violence,Unidentified Armed Group (Afghanistan),Refugees/IDPs (Afghanistan),3,Rioters (Syria),Refugees/IDPs (Syria),5,35,Europe,Greece,North Aegean,Samos,Samos,Samos,37.7574,26.9762,1,AMNA; Ekathimerini; To Vima,National,"On 14 October, a violent incident erupted in the regional capital of Samos between a group of Afghans and a group of Syrian asylum seekers. Three Syrians were stabbed with sharp objects and were hospitalised. The incident resulted in clashes spreading in the reception centre of Samos, where a fire broke out burning a large part of the camp. There were no injuries. Over the following days, more police was sent to the island and 12 people were arrested. [size=no report]",0,1571776728,GRC
6160636,300,GRC1019,1019,2019-10-14,2019,1,Protests,Peaceful protest,Protesters (Greece),,6,,,0,60,Europe,Greece,North Aegean,Lesbos,Lesbos,Skala Sykamineas,39.3732,26.3028,1,Ekathimerini; To Vima,National,"On 14 October, residents from nearby villages protested at Skala Sykamineas in Lesvos by symbolically throwing rocks at humanitarian vessel Open Arms and preventing it from docking. The vessel with 100 refugees and migrants on board from rescue missions in the Meditarrenean remained anchored at around 200 meters from the coast. [size=no report]",0,1571776728,GRC
6025356,300,GRC1001,1001,2019-10-12,2019,1,Protests,Peaceful protest,Protesters (Greece),Kurdish Ethnic Group (Greece); ANTARSYA: Front of the Greek Anticapitalist Left,6,,,0,60,Europe,Greece,Central Macedonia,Thessaloniki,Thessaloniki,Thessaloniki,40.6436,22.9309,1,To Vima; MAKEDONIA; Ekathimerini,Subnational-National,"On 12 October, Kurdish protesters and their left-wing supporters including ANTARSYA, reaching about 1,000 protesters in total, demonstrated in central Thessaloniki in solidarity with the Kurdish population in north-eastern Syria that is under attack by Turkey. They shouted slogans against the president of Turkey and they burned pictures of him and Turkish flags. [size=about 1,000]",0,1571160220,GRC
6025362,300,GRC1014,1014,2019-10-12,2019,1,Riots,Mob violence,Rioters (Greece),,5,Police Forces of Greece (2019-),,1,15,Europe,Greece,Attica,Athens,North Athens,Athens-North Athens,38.0465,23.8146,1,To Vima; Ekathimerini,National,"On 12 September, in the morning, a group of unknown assailants targeted with petrol bombs a police station in Penteli in north Athens damaging a parked police car. No injuries were reported. Four people were detained briefly. [size=no report]",0,1571160220,GRC
6025364,300,GRC1017,1017,2019-10-12,2019,1,Protests,Peaceful protest,Protesters (Greece),Kurdish Ethnic Group (Greece); SYRIZA: Coalition of the Radical Left,6,,,0,60,Europe,Greece,Attica,Athens,Central Athens,Athens-Central Athens,37.9685,23.7585,1,I Avgi; To Vima; Ekathimerini,National,"On 12 October, about 2,000 Kurdish protesters and members of leftist organisations including the youth wing of SYRIZA demonstrated in Athens in solidarity with the Kurdish population in north-eastern Syria that is under attack by Turkey. Police had blocked the way to the Turkish embassy. A small contingent of 150 protesters marched to the US embassy. [size=about 2,000]",0,1571160220,GRC
6025650,300,GRC1015,1015,2019-10-12,2019,1,Riots,Mob violence,Rioters (Greece),,5,Police Forces of Greece (2019-) Units for the Reinstatement of Order,,1,15,Europe,Greece,Attica,Athens,Central Athens,Athens-Central Athens,37.9685,23.7585,1,Ekathimerini,National,"On 12 September, unidentified assailants hurled bottles and stones at a riot police unit stationed in Exarchia. This attack occurred an hour after a police station was targeted in Penteli in north Athens. [size=no report]",0,1571160220,GRC
6160637,300,GRC1020,1020,2019-10-12,2019,1,Protests,Peaceful protest,Protesters (Greece),,6,,,0,60,Europe,Greece,Thessaly,Karditsa,Karditsa,Karditsa,39.3648,21.9219,1,To Pontiki,National,"On 12 October, more than 1,000 demonstrators from all over Greece rallied in central Karditsa and marched in the city to protest against installing wind turbines on Agrafa, the southernmost part of the Pindus mountain range. There was discreet police presence but the protest was peaceful. [size=more than 1,000]",0,1571776728,GRC
6025361,300,GRC1013,1013,2019-10-11,2019,1,Riots,Violent demonstration,Rioters (Greece),Students (Greece),5,Police Forces of Greece (2019-) Units for the Reinstatement of Order,,1,15,Europe,Greece,Attica,Athens,Central Athens,Athens-Central Athens,37.9685,23.7585,1,Ekathimerini; AMNA; FoititikaNea,National,"On 11 October, a student demonstration in Athens against the abolition of the university asylum law and other reforms to the higher education system turned violent when students tried to break a police cordon barring access to the Parliament building using wooden sticks. Police responded with tear gas and stun grenades. No injuries or detentions were reported. Students also occupied at least 16 university buildings in Athens and other cities.[size=no report]",0,1571160220,GRC
6025363,300,GRC1016,1016,2019-10-11,2019,1,Protests,Peaceful protest,Protesters (Greece),Students (Greece),6,,,0,60,Europe,Greece,Central Macedonia,Thessaloniki,Thessaloniki,Thessaloniki,40.6436,22.9309,1,FoititikaNea; MAKEDONIA; To Pontiki,Subnational-National,"On 11 October, students marched in central Thessaloniki to protest against the abolition of the university asylum law and other reforms to the higher education system. When they arrived at the Ministry of Macedonia-Thrace they spray-painted slogans. Students also occupied the buildings of at least three Aristotle University schools in protest. [size=no report]",0,1571160220,GRC
6025359,300,GRC1005,1005,2019-10-10,2019,1,Protests,Peaceful protest,Protesters (Greece),OENGE: National Federation of Unions of Greek Doctors; Health Workers (Greece),6,,,0,60,Europe,Greece,Attica,Athens,Central Athens,Athens-Central Athens,37.9685,23.7585,1,AMNA; ERT,National,"On 10 October, public hospital doctors from Athens and Piraeus with the support of their unions and federation ONGE protested at the Health Ministry against the decision to cancel the appointments of 208 specialist doctors. [size=no report]",0,1571160220,GRC
6025366,300,GRC997,997,2019-10-10,2019,1,Riots,Mob violence,Rioters (Greece),,5,Police Forces of Greece (2019-) Units for the Reinstatement of Order,,1,15,Europe,Greece,Attica,Athens,Central Athens,Athens-Central Athens,37.9685,23.7585,1,Ekathimerini; To Vima; AMNA,National,"On 10 October, about 25 people attacked a MAT riot police unit in Exarchia with petrol bombs and rocks. Police responded with chemicals and stun grenades. One police officer sustained a head injury. No detentions were reported. [size=about 25]",0,1571160220,GRC
6025651,300,GRC1006,1006,2019-10-10,2019,1,Protests,Peaceful protest,Protesters (Greece),Teachers (Greece),6,,,0,60,Europe,Greece,Attica,Athens,North Athens,Athens-North Athens,38.0465,23.8146,1,ERT,National,"On 10 October, substitute teachers protested at the Ministry of Education for speeding up the procedure for permanent appointments. [size=no report]",0,1571160220,GRC
6025678,300,GRC1012,1012,2019-10-10,2019,1,Protests,Peaceful protest,Protesters (Greece),Labour Group (Greece),6,,,0,60,Europe,Greece,Central Macedonia,Thessaloniki,Thessaloniki,Thessaloniki,40.6436,22.9309,1,MAKEDONIA,Subnational,"On 10 October, former Coca-Cola employees participated in a motorcade to protest for the re-opening of the factory producing Coca-Cola in Thessaloniki. [size=no report]",0,1571160220,GRC
6025890,300,GRC998,998,2019-10-10,2019,1,Protests,Peaceful protest,Protesters (International),Kurdish Ethnic Group (Greece); Refugees/IDPs (International); Refugees/IDPs (Syria),6,,,0,60,Europe,Greece,Central Greece,Euboea,Chalcis,Ritsona,38.4100,23.5236,1,To Vima,National,"On 10 October, about 600 Kurdish refugees many of them from Syria hosted in the Ritsona camp near Chalcis blocked symbolically the road in front of the reception centre and protested in tears holding banners against Turkey's military operation in Syria. [size=about 600]",0,1571160221,GRC
6025358,300,GRC1003,1003,2019-10-09,2019,1,Protests,Protest with intervention,Protesters (Greece),Rouvikonas,6,Police Forces of Greece (2019-),,1,16,Europe,Greece,Attica,Athens,Central Athens,Athens-Central Athens,37.9685,23.7585,1,Ekathimerini; To Vima,National,"On 9 October, 20-30 members of Rouvikonas entered the Ministry of Labour scattering fliers and reached the building's first floor to protest over the proposed labour law reforms. Police detained six people. [size=20-30]",0,1571160220,GRC
6025360,300,GRC1008,1008,2019-10-09,2019,1,Protests,Peaceful protest,Protesters (Greece),Kurdish Ethnic Group (Greece),6,,,0,60,Europe,Greece,Attica,Athens,Central Athens,Athens-Central Athens,37.9685,23.7585,1,To Pontiki; To Vima,National,"On 9 October, Kurdish men, women and children who reside in Greece marched in central Athens to protest against Turkey's military operation in Syria. Police forces had blocked the road before they reached the Turkish embassy. [size=no report]",0,1571160220,GRC
6025559,300,GRC999,999,2019-10-09,2019,1,Protests,Peaceful protest,Protesters (Greece),Health Workers (Greece),6,,,0,60,Europe,Greece,Attica,Athens,Central Athens,Athens-Central Athens,37.9685,23.7585,1,AMNA,National,"On 9 October, members and supporters of KETHEA rallied at the Ministry of Health to demonstrate against the proposed legislation to abolish KETHEA's self-management and to protest for the right to free, voluntary and dry (no drugs or substitutes) rehabilitation. [size=no report]",0,1571160220,GRC
